{
  "event_id": "rbc_news:123456",
  "event_type": "persisted",
  "event_timestamp": "2026-01-31T14:23:46.500Z",
  "event_version": "v1.0.0",
  "source_system": "message-persister",
  "trace_id": "550e8400-e29b-41d4-a716-446655440000",
  "payload": {
    "message_id": 123456,
    "channel": "rbc_news",
    "db_id": "8f7e6d5c-4b3a-2901-8765-fedcba098765",
    "persisted_at": "2026-01-31T14:23:46.500Z",
    "status": "success"
  }
}
